{
  "required_sections": [
    "Problem Statement",
    "Solution",
    "User Stories",
    "Implementation Decisions",
    "Testing Decisions",
    "Out of Scope",
    "Further Notes"
  ],
  "story_format": "as-a-i-want-so-that",
  "allow_prototype_snippets": true,
  "glossary_pack": "domain-glossary"
}
